{
  "$schema": "https://json-schema.org/draft/2020-12/schema",
  "$id": "https://gitapex.io/schemas/scorer-gated-skill-edits/eval-scores.schema.json",
  "title": "Skill eval per-model score file",
  "description": "Shape of one model's score file, the attachment a run record's `score_files[].file` points at (see eval-run.schema.json). One file per model actually run, named by that model's full identifier rather than a short alias. Additional keys are permitted so a run may carry per-model context this contract does not anticipate.",
  "type": "object",
  "required": ["model_id", "n_fixtures", "mean_score", "scores"],
  "properties": {
    "model_id": {
      "type": "string",
      "minLength": 1,
      "description": "The full, current model identifier actually invoked -- the same string this model is keyed to in the run record's `models` map. Never a short alias: an alias can resolve to a different underlying model later, and this file is a permanent record of what really ran."
    },
    "n_fixtures": {
      "type": "integer",
      "minimum": 1,
      "description": "How many fixtures this model was scored on. Stated rather than inferred from the array length, so a truncated or partially written file disagrees with itself loudly instead of reading as a smaller complete run."
    },
    "mean_score": {
      "type": "number",
      "minimum": 0,
      "maximum": 1,
      "description": "The mean of this file's per-fixture scores, on the same [0,1] scale the Precondition gate requires of any scorer. Recorded at the precision the scorer published it at: a gate comparison against a differently-rounded prior is ambiguous input, and SKILL.md's Gate step fails loudly on one rather than arbitrating it."
    },
    "scores": {
      "type": "array",
      "minItems": 1,
      "description": "Per-fixture results, sorted by `fixture_id` so two runs of the same corpus produce a stable diff.",
      "items": {
        "type": "object",
        "required": ["fixture_id", "score"],
        "properties": {
          "fixture_id": {
            "type": "string",
            "minLength": 1,
            "description": "The fixture's own declared identifier, as the fixture file states it -- not a positional index, which stops meaning anything the moment the corpus grows."
          },
          "score": {
            "type": "number",
            "minimum": 0,
            "maximum": 1,
            "description": "This fixture's score on the [0,1] scale."
          },
          "split": {
            "type": "string",
            "enum": ["train", "selection", "test"],
            "description": "Optional. Which split this fixture belongs to. Recording it lets a reader confirm that the gate verdict was computed over the selection split alone, rather than trusting that it was."
          },
          "content_policy_partial_rejection": {
            "type": "string",
            "minLength": 1,
            "description": "Optional. Present only when this fixture's own trials were not all attempted: one or more of its trials already succeeded (and are reflected in `score`/`trials`) before a later trial tripped Anthropic's own content-policy classifier (gitapex_run_eval_suite.py's own _is_content_policy_rejection). A safe, redacted reason, same convention as `skipped_fixtures[].reason` -- never a RuntimeError's or TimeoutExpired's own raw text. A fixture with NO successful trial is not scored at all and appears in `skipped_fixtures` instead, never here."
          }
        }
      }
    },
    "skipped_fixtures": {
      "type": "array",
      "description": "Optional. Fixtures with zero successful trials, skipped outright rather than scored -- today, a fixture whose every trial's model-CLI invocation tripped Anthropic's own content-policy classifier (gitapex_run_eval_suite.py's own _is_content_policy_rejection). Excluded from `n_fixtures`/`mean_score`/`scores` entirely, recorded here so a skip is loud and visible rather than silently absent. A fixture with at least one successful trial before a later rejection is scored on that successful subset instead -- see `scores[].content_policy_partial_rejection`, not this list. Always present (possibly empty) in output produced by gitapex_run_eval_suite.py; absent in a file written before this field existed, which this schema's own additional-properties permissiveness already tolerated before this field was named explicitly.",
      "items": {
        "type": "object",
        "required": ["fixture_id", "reason"],
        "properties": {
          "fixture_id": {
            "type": "string",
            "minLength": 1,
            "description": "The skipped fixture's own declared identifier, same convention as `scores[].fixture_id`."
          },
          "reason": {
            "type": "string",
            "minLength": 1,
            "description": "A safe, redacted reason -- never a RuntimeError's or TimeoutExpired's own raw text, which can embed a live model CLI's stderr or a fixture's prompt (see gitapex_run_ablation.redact_executor_failure_reason)."
          }
        }
      }
    }
  }
}
